{
  "schema_version": "1.0",
  "registry_id": "symbolic_definitions_v1",
  "registry_sha256": "sha256:a9cf1949adbccd589a93c9da8b3a41d6c122f94cfb41f3132f89097a537c56c3",
  "created_at": "2026-09-04T12:00:00Z",
  "definitions": [
    {
      "definition_id": "def_A000012_v1",
      "sequence_ref": {
        "oeis_id": "A000012",
        "index_scale": 1,
        "index_shift": 0
      },
      "kind": "CLOSED_FORM",
      "source": {
        "reference": "Repository formula assumption (not verified against OEIS)",
        "revision": "007-phase7",
        "content_sha256": "sha256:6b86b273ff34fce19d6b804eff5a3f5747ada4eaa22f1d49c01e52ddb7875b4b"
      },
      "expression": "1",
      "domain": {
        "integer_only": true,
        "lower_bound": 0,
        "upper_bound": null
      },
      "assumptions": [
        "n >= 0",
        "Formula-to-OEIS correspondence is an external assumption."
      ],
      "parser_version": "bounded-rational/v1",
      "expression_sha256": "sha256:6b86b273ff34fce19d6b804eff5a3f5747ada4eaa22f1d49c01e52ddb7875b4b"
    },
    {
      "definition_id": "def_A000027_v1",
      "sequence_ref": {
        "oeis_id": "A000027",
        "index_scale": 1,
        "index_shift": 0
      },
      "kind": "CLOSED_FORM",
      "source": {
        "reference": "Repository formula assumption (not verified against OEIS)",
        "revision": "007-phase7",
        "content_sha256": "sha256:1b16b1df538ba12dc3f97edbb85caa7050d46c148134290feba80f8236c83db9"
      },
      "expression": "n",
      "domain": {
        "integer_only": true,
        "lower_bound": 0,
        "upper_bound": null
      },
      "assumptions": [
        "n >= 0",
        "Formula-to-OEIS correspondence is an external assumption."
      ],
      "parser_version": "bounded-rational/v1",
      "expression_sha256": "sha256:1b16b1df538ba12dc3f97edbb85caa7050d46c148134290feba80f8236c83db9"
    },
    {
      "definition_id": "def_A000217_v1",
      "sequence_ref": {
        "oeis_id": "A000217",
        "index_scale": 1,
        "index_shift": 0
      },
      "kind": "CLOSED_FORM",
      "source": {
        "reference": "Repository formula assumption (not verified against OEIS)",
        "revision": "007-phase7",
        "content_sha256": "sha256:1a094164fd7efc0634c5091c65f45e8dba86b42ad0a7c8398627f98db5790663"
      },
      "expression": "n*(n + 1)/2",
      "domain": {
        "integer_only": true,
        "lower_bound": 0,
        "upper_bound": null
      },
      "assumptions": [
        "n >= 0",
        "Formula-to-OEIS correspondence is an external assumption."
      ],
      "parser_version": "bounded-rational/v1",
      "expression_sha256": "sha256:1a094164fd7efc0634c5091c65f45e8dba86b42ad0a7c8398627f98db5790663"
    },
    {
      "definition_id": "def_A000290_v1",
      "sequence_ref": {
        "oeis_id": "A000290",
        "index_scale": 1,
        "index_shift": 0
      },
      "kind": "CLOSED_FORM",
      "source": {
        "reference": "Repository formula assumption (not verified against OEIS)",
        "revision": "007-phase7",
        "content_sha256": "sha256:62575584b1ecc552a79a63a0692124668678520a7b9203d1ba10f63924addb8e"
      },
      "expression": "n**2",
      "domain": {
        "integer_only": true,
        "lower_bound": 0,
        "upper_bound": null
      },
      "assumptions": [
        "n >= 0",
        "Formula-to-OEIS correspondence is an external assumption."
      ],
      "parser_version": "bounded-rational/v1",
      "expression_sha256": "sha256:62575584b1ecc552a79a63a0692124668678520a7b9203d1ba10f63924addb8e"
    },
    {
      "definition_id": "def_A100000_v1",
      "sequence_ref": {
        "oeis_id": "A100000",
        "index_scale": 1,
        "index_shift": 0
      },
      "kind": "CLOSED_FORM",
      "source": {
        "reference": "Repository formula assumption (not verified against OEIS)",
        "revision": "007-phase7",
        "content_sha256": "sha256:62575584b1ecc552a79a63a0692124668678520a7b9203d1ba10f63924addb8e"
      },
      "expression": "n**2",
      "domain": {
        "integer_only": true,
        "lower_bound": 0,
        "upper_bound": null
      },
      "assumptions": [
        "n >= 0",
        "Formula-to-OEIS correspondence is an external assumption."
      ],
      "parser_version": "bounded-rational/v1",
      "expression_sha256": "sha256:62575584b1ecc552a79a63a0692124668678520a7b9203d1ba10f63924addb8e"
    },
    {
      "definition_id": "def_A005408_v1",
      "sequence_ref": {
        "oeis_id": "A005408",
        "index_scale": 1,
        "index_shift": 0
      },
      "kind": "CLOSED_FORM",
      "source": {
        "reference": "Repository formula assumption (not verified against OEIS)",
        "revision": "007-phase7",
        "content_sha256": "sha256:b6fe592523a87a2723d5d45c9d7f1603b29e7109a7c0e7925785e42c7728546c"
      },
      "expression": "2*n + 1",
      "domain": {
        "integer_only": true,
        "lower_bound": 0,
        "upper_bound": null
      },
      "assumptions": [
        "n >= 0",
        "Formula-to-OEIS correspondence is an external assumption."
      ],
      "parser_version": "bounded-rational/v1",
      "expression_sha256": "sha256:b6fe592523a87a2723d5d45c9d7f1603b29e7109a7c0e7925785e42c7728546c"
    }
  ]
}
